{
  "schema_version": 1,
  "kind": "board",
  "id": "emblink/explorer16-32-pic24",
  "version": "1.0.0",
  "name": "Explorer 16/32 (PIC24FJ1024GB610 PIM)",
  "description": "Microchip's Explorer 16/32 development board with the PIC24FJ1024GB610 plug-in module: an 8 MHz crystal on the primary oscillator and a 32.768 kHz one on the secondary, eight LEDs D3 to D10 on RA0 to RA7 (active high), the push buttons S3 (RD6), S6 (RD7) and S4 (RD13) to ground with pull-ups, MCLR's S1, a 3.3 V regulator from VIN, and the USB-UART bridge on RF5 and RF4, which the PPS gives UART2 (RP17 U2TX, RP10 U2RX), the session's console.",
  "keywords": [
    "explorer 16",
    "explorer 16/32",
    "dm240001-2",
    "pic24",
    "pic24fj",
    "pim",
    "xc16"
  ],
  "revision": "DM240001-2 with MA240023",
  "mcu": {
    "ref": "microchip/pic24fj1024gb610",
    "package": "tqfp100",
    "instance": "U1"
  },
  "oscillators": {
    "hse": {
      "hz": 8000000,
      "source": "external_crystal",
      "component": "Y1"
    }
  },
  "components": [
    {
      "id": "U2",
      "component": "emblink/regulator",
      "params": {
        "part": "generic",
        "vout": 3.3,
        "dropout": 0.3,
        "imax": 1.0,
        "quiescent": 0
      },
      "doc": "3.3 V from VIN (the board's MCP1727 LDO, fed from the USB-C 5 V or the 9 V barrel)"
    },
    {
      "id": "Y1",
      "component": "emblink/crystal",
      "params": {
        "hz": "8meg"
      },
      "doc": "The PIM's 8 MHz crystal on OSC1/OSC2 (the primary oscillator)"
    },
    {
      "id": "Y2",
      "component": "emblink/crystal",
      "params": {
        "hz": "32.768k"
      },
      "doc": "The 32.768 kHz crystal on SOSCI/SOSCO"
    },
    {
      "id": "D3",
      "component": "emblink/led",
      "params": {
        "color": "red"
      },
      "doc": "LED D3 on RA0, active high"
    },
    {
      "id": "R_D3",
      "component": "emblink/resistor",
      "params": {
        "resistance": "470"
      }
    },
    {
      "id": "D4",
      "component": "emblink/led",
      "params": {
        "color": "red"
      },
      "doc": "LED D4 on RA1, active high"
    },
    {
      "id": "R_D4",
      "component": "emblink/resistor",
      "params": {
        "resistance": "470"
      }
    },
    {
      "id": "D5",
      "component": "emblink/led",
      "params": {
        "color": "red"
      },
      "doc": "LED D5 on RA2, active high"
    },
    {
      "id": "R_D5",
      "component": "emblink/resistor",
      "params": {
        "resistance": "470"
      }
    },
    {
      "id": "D6",
      "component": "emblink/led",
      "params": {
        "color": "red"
      },
      "doc": "LED D6 on RA3, active high"
    },
    {
      "id": "R_D6",
      "component": "emblink/resistor",
      "params": {
        "resistance": "470"
      }
    },
    {
      "id": "D7",
      "component": "emblink/led",
      "params": {
        "color": "red"
      },
      "doc": "LED D7 on RA4, active high"
    },
    {
      "id": "R_D7",
      "component": "emblink/resistor",
      "params": {
        "resistance": "470"
      }
    },
    {
      "id": "D8",
      "component": "emblink/led",
      "params": {
        "color": "red"
      },
      "doc": "LED D8 on RA5, active high"
    },
    {
      "id": "R_D8",
      "component": "emblink/resistor",
      "params": {
        "resistance": "470"
      }
    },
    {
      "id": "D9",
      "component": "emblink/led",
      "params": {
        "color": "red"
      },
      "doc": "LED D9 on RA6, active high"
    },
    {
      "id": "R_D9",
      "component": "emblink/resistor",
      "params": {
        "resistance": "470"
      }
    },
    {
      "id": "D10",
      "component": "emblink/led",
      "params": {
        "color": "red"
      },
      "doc": "LED D10 on RA7, active high"
    },
    {
      "id": "R_D10",
      "component": "emblink/resistor",
      "params": {
        "resistance": "470"
      }
    },
    {
      "id": "S3",
      "component": "emblink/push_button",
      "doc": "Push button S3 on RD6, to ground"
    },
    {
      "id": "R_S3",
      "component": "emblink/pull_up",
      "params": {
        "resistance": "10k",
        "voltage": 3.3
      },
      "doc": "RD6 pulled up"
    },
    {
      "id": "S6",
      "component": "emblink/push_button",
      "doc": "Push button S6 on RD7, to ground"
    },
    {
      "id": "R_S6",
      "component": "emblink/pull_up",
      "params": {
        "resistance": "10k",
        "voltage": 3.3
      },
      "doc": "RD7 pulled up"
    },
    {
      "id": "S4",
      "component": "emblink/push_button",
      "doc": "Push button S4 on RD13, to ground"
    },
    {
      "id": "R_S4",
      "component": "emblink/pull_up",
      "params": {
        "resistance": "10k",
        "voltage": 3.3
      },
      "doc": "RD13 pulled up"
    },
    {
      "id": "S1",
      "component": "emblink/push_button",
      "doc": "MCLR: resets the PIC24"
    },
    {
      "id": "R_MCLR",
      "component": "emblink/pull_up",
      "params": {
        "resistance": "10k",
        "voltage": 3.3
      },
      "doc": "MCLR pulled up"
    },
    {
      "id": "J1",
      "component": "emblink/header",
      "params": {
        "pins": 20
      },
      "doc": "The PICtail Plus edge, left: 3.3 V, port B's analog pins, port D"
    },
    {
      "id": "J2",
      "component": "emblink/header",
      "params": {
        "pins": 20
      },
      "doc": "The PICtail Plus edge, right: VIN, ports E, G, F and A's upper pins"
    },
    {
      "id": "J_USB",
      "component": "emblink/header",
      "params": {
        "pins": 2
      },
      "doc": "The MCP2221A USB-UART bridge's side of UART2: RF5 (RP17, U2TX) and RF4 (RP10, U2RX) as the firmware's PPS maps them; the session's serial console"
    },
    {
      "id": "J_ICSP",
      "component": "emblink/header",
      "params": {
        "pins": 5
      },
      "doc": "The PICkit/ICSP header: MCLR, 3.3 V, GND, PGED2 (RB7), PGEC2 (RB6)"
    }
  ],
  "nets": {
    "VIN": [
      "U2.IN",
      "J2.1"
    ],
    "3V3": [
      "U2.OUT",
      "U1.VDD",
      "U1.AVDD",
      "U1.VUSB3V3",
      "U1.VCAP",
      "U1.VBAT",
      "J1.1",
      "J_ICSP.2"
    ],
    "GND": [
      "U2.GND",
      "U1.VSS",
      "U1.AVSS",
      "J1.2",
      "J1.20",
      "J2.2",
      "J_ICSP.3",
      "S1.2",
      "D3.K",
      "D4.K",
      "D5.K",
      "D6.K",
      "D7.K",
      "D8.K",
      "D9.K",
      "D10.K",
      "S3.2",
      "S6.2",
      "S4.2"
    ],
    "MCLR": [
      "U1.NRST",
      "R_MCLR.1",
      "S1.1",
      "J_ICSP.1"
    ],
    "RG15": [
      "U1.RG15"
    ],
    "RE5": [
      "U1.RE5",
      "J2.8"
    ],
    "RE6": [
      "U1.RE6",
      "J2.9"
    ],
    "RE7": [
      "U1.RE7",
      "J2.10"
    ],
    "RC1": [
      "U1.RC1"
    ],
    "RC2": [
      "U1.RC2"
    ],
    "RC3": [
      "U1.RC3"
    ],
    "RC4": [
      "U1.RC4"
    ],
    "RG6": [
      "U1.RG6",
      "J2.11"
    ],
    "RG7": [
      "U1.RG7",
      "J2.12"
    ],
    "RG8": [
      "U1.RG8",
      "J2.13"
    ],
    "RG9": [
      "U1.RG9",
      "J2.14"
    ],
    "RA0": [
      "U1.RA0",
      "R_D3.1"
    ],
    "RE8": [
      "U1.RE8"
    ],
    "RE9": [
      "U1.RE9"
    ],
    "RB5": [
      "U1.RB5",
      "J1.8"
    ],
    "RB4": [
      "U1.RB4",
      "J1.7"
    ],
    "RB3": [
      "U1.RB3",
      "J1.6"
    ],
    "RB2": [
      "U1.RB2",
      "J1.5"
    ],
    "RB1": [
      "U1.RB1",
      "J1.4"
    ],
    "RB0": [
      "U1.RB0",
      "J1.3"
    ],
    "RB6": [
      "U1.RB6",
      "J_ICSP.5"
    ],
    "RB7": [
      "U1.RB7",
      "J_ICSP.4"
    ],
    "RA9": [
      "U1.RA9",
      "J2.17"
    ],
    "RA10": [
      "U1.RA10",
      "J2.18"
    ],
    "RB8": [
      "U1.RB8"
    ],
    "RB9": [
      "U1.RB9"
    ],
    "RB10": [
      "U1.RB10"
    ],
    "RB11": [
      "U1.RB11"
    ],
    "RA1": [
      "U1.RA1",
      "R_D4.1"
    ],
    "RF13": [
      "U1.RF13"
    ],
    "RF12": [
      "U1.RF12"
    ],
    "RB12": [
      "U1.RB12"
    ],
    "RB13": [
      "U1.RB13"
    ],
    "RB14": [
      "U1.RB14"
    ],
    "RB15": [
      "U1.RB15"
    ],
    "RD14": [
      "U1.RD14"
    ],
    "RD15": [
      "U1.RD15"
    ],
    "RF4": [
      "U1.RF4",
      "J_USB.2",
      "J2.15"
    ],
    "RF5": [
      "U1.RF5",
      "J_USB.1",
      "J2.16"
    ],
    "RF3": [
      "U1.RF3"
    ],
    "RF2": [
      "U1.RF2"
    ],
    "RF8": [
      "U1.RF8"
    ],
    "RF7": [
      "U1.RF7"
    ],
    "RG3": [
      "U1.RG3"
    ],
    "RG2": [
      "U1.RG2"
    ],
    "RA2": [
      "U1.RA2",
      "R_D5.1"
    ],
    "RA3": [
      "U1.RA3",
      "R_D6.1"
    ],
    "RA4": [
      "U1.RA4",
      "R_D7.1"
    ],
    "RA5": [
      "U1.RA5",
      "R_D8.1"
    ],
    "RC12": [
      "U1.RC12",
      "Y1.1"
    ],
    "RC15": [
      "U1.RC15",
      "Y1.2"
    ],
    "RA14": [
      "U1.RA14",
      "J2.19"
    ],
    "RA15": [
      "U1.RA15",
      "J2.20"
    ],
    "RD8": [
      "U1.RD8",
      "J1.15"
    ],
    "RD9": [
      "U1.RD9",
      "J1.16"
    ],
    "RD10": [
      "U1.RD10",
      "J1.17"
    ],
    "RD11": [
      "U1.RD11",
      "J1.18"
    ],
    "RD0": [
      "U1.RD0",
      "J1.9"
    ],
    "RC13": [
      "U1.RC13",
      "Y2.1"
    ],
    "RC14": [
      "U1.RC14",
      "Y2.2"
    ],
    "RD1": [
      "U1.RD1",
      "J1.10"
    ],
    "RD2": [
      "U1.RD2",
      "J1.11"
    ],
    "RD3": [
      "U1.RD3",
      "J1.12"
    ],
    "RD12": [
      "U1.RD12",
      "J1.19"
    ],
    "RD13": [
      "U1.RD13",
      "S4.1",
      "R_S4.1"
    ],
    "RD4": [
      "U1.RD4",
      "J1.13"
    ],
    "RD5": [
      "U1.RD5",
      "J1.14"
    ],
    "RD6": [
      "U1.RD6",
      "S3.1",
      "R_S3.1"
    ],
    "RD7": [
      "U1.RD7",
      "S6.1",
      "R_S6.1"
    ],
    "RF0": [
      "U1.RF0"
    ],
    "RF1": [
      "U1.RF1"
    ],
    "RG1": [
      "U1.RG1"